{"canonical_series":"y=c0+sum(c_n*exp(i*2*pi*n*f*(t-t0))+conjugate)","coefficient_covariance":[[3.4279514967838386e-05,8.041593743456412e-07,8.818304793873536e-07,-2.334509591405593e-06,8.146566452271759e-07,6.1080146910598e-07,3.334543414533487e-08,6.395839154735695e-07,6.170008214092447e-07,-9.281772182467986e-07,-2.800545209279988e-07,-4.295012103359843e-07,-1.5900042393507206e-06,-5.00963329039353e-07,1.8090062322047945e-06,4.427680110287774e-06],[8.041593743456412e-07,3.4890019921620044e-05,-1.414149501880154e-06,1.5444832269862186e-06,-1.6666275975422632e-06,6.826264676338709e-07,1.2996260099807712e-06,2.0840165613950922e-07,-1.8253644224964772e-06,4.4643865364745124e-07,-1.1338280790332642e-06,-1.891058360148752e-06,-9.141342544954293e-07,6.49803867353461e-07,3.621708306781221e-06,2.6602567560958884e-06],[8.818304793873536e-07,-1.414149501880154e-06,3.574105526441985e-05,-9.67030778841035e-07,1.494761755282909e-06,-1.1342947917176628e-06,9.233757846534794e-07,7.129279675947883e-07,1.1962454065119353e-06,-2.0446336290668146e-06,-1.047291370196099e-06,-1.6857707645318184e-06,2.365894373313118e-07,3.4680570737385893e-06,1.1793189303956674e-06,1.9125171234042993e-06],[-2.334509591405593e-06,1.5444832269862186e-06,-9.67030778841035e-07,3.5695061655601614e-05,-4.6643355280155167e-07,1.7192324103742196e-06,-1.7154719920867256e-06,1.2303484095910715e-06,-2.808945161033929e-06,-1.8883219592957276e-07,-2.477666038562817e-06,1.1027238024460393e-06,2.7339447402441287e-06,9.684426889709494e-07,1.6762921519460165e-06,-2.0951160126800587e-06],[8.146566452271759e-07,-1.6666275975422632e-06,1.494761755282909e-06,-4.6643355280155167e-07,3.5844636743058966e-05,-9.376402934419005e-07,2.0259676184126798e-06,-2.042272190298696e-06,-5.213850995525458e-07,-3.2527335959567155e-06,1.9521976654845317e-06,1.9996642680973657e-06,1.7189522275976093e-06,7.914027947832962e-07,-2.2916957177977975e-06,6.283231018415146e-07],[6.1080146910598e-07,6.826264676338709e-07,-1.1342947917176628e-06,1.7192324103742196e-06,-9.376402934419005e-07,3.613919927721753e-05,-1.2733401442273831e-06,1.723294093800694e-06,-3.5127378689145245e-06,1.5806911856399932e-06,1.073927056470467e-06,2.425551340165108e-06,7.187571632587636e-08,-1.5255484806603462e-06,-1.9340582241084954e-07,-8.015655836608492e-07],[3.334543414533487e-08,1.2996260099807712e-06,9.233757846534794e-07,-1.7154719920867256e-06,2.0259676184126798e-06,-1.2733401442273831e-06,3.585689383309053e-05,-1.4822398015853055e-08,1.620984291107079e-07,8.116060362204568e-07,2.1677424476108454e-06,-7.500904467163369e-07,-8.877615586046809e-07,-9.485504963062671e-07,-1.3355463561233198e-07,5.922726855499028e-07],[6.395839154735695e-07,2.0840165613950922e-07,7.129279675947883e-07,1.2303484095910715e-06,-2.042272190298696e-06,1.723294093800694e-06,-1.4822398015853055e-08,3.406362058354173e-05,2.4485392783999085e-07,7.694807069461878e-07,-9.861590126803152e-07,-1.1429453335642386e-06,-1.7403391760865938e-06,5.564687698053386e-07,-1.7459950008448796e-07,3.875292640968017e-07],[6.170008214092447e-07,-1.8253644224964772e-06,1.1962454065119353e-06,-2.808945161033929e-06,-5.213850995525458e-07,-3.5127378689145245e-06,1.620984291107079e-07,2.4485392783999085e-07,3.61282705085877e-05,-3.392464609094505e-06,1.4740097965085634e-06,-1.7885696784920902e-06,-1.7642351662841389e-07,-1.0301088996985774e-07,-8.907038171734124e-07,-1.3609799606814917e-06],[-9.281772182467986e-07,4.4643865364745124e-07,-2.0446336290668146e-06,-1.8883219592957276e-07,-3.2527335959567155e-06,1.5806911856399932e-06,8.116060362204568e-07,7.694807069461878e-07,-3.392464609094505e-06,3.545429918496195e-05,-1.2355510271978093e-06,5.243981878308943e-07,-2.4486287319590275e-06,-2.0921497655039656e-07,-6.267210675728297e-07,-1.135461610492227e-06],[-2.800545209279988e-07,-1.1338280790332642e-06,-1.047291370196099e-06,-2.477666038562817e-06,1.9521976654845317e-06,1.073927056470467e-06,2.1677424476108454e-06,-9.861590126803152e-07,1.4740097965085634e-06,-1.2355510271978093e-06,3.456181765456136e-05,-1.7723203934576309e-06,5.916496265333394e-07,-3.0837142787961675e-06,-3.562599134118391e-07,-1.0455305407828258e-07],[-4.295012103359843e-07,-1.891058360148752e-06,-1.6857707645318184e-06,1.1027238024460393e-06,1.9996642680973657e-06,2.425551340165108e-06,-7.500904467163369e-07,-1.1429453335642386e-06,-1.7885696784920902e-06,5.243981878308943e-07,-1.7723203934576309e-06,3.4689051766957514e-05,-2.1852353437485e-06,3.622248003435541e-07,-2.4150762714210922e-06,-7.659669795890006e-07],[-1.5900042393507206e-06,-9.141342544954293e-07,2.365894373313118e-07,2.7339447402441287e-06,1.7189522275976093e-06,7.187571632587636e-08,-8.877615586046809e-07,-1.7403391760865938e-06,-1.7642351662841389e-07,-2.4486287319590275e-06,5.916496265333394e-07,-2.1852353437485e-06,3.454115129680267e-05,-1.6498861202785164e-06,1.941915077501194e-08,-2.0754140674270867e-06],[-5.00963329039353e-07,6.49803867353461e-07,3.4680570737385893e-06,9.684426889709494e-07,7.914027947832962e-07,-1.5255484806603462e-06,-9.485504963062671e-07,5.564687698053386e-07,-1.0301088996985774e-07,-2.0921497655039656e-07,-3.0837142787961675e-06,3.622248003435541e-07,-1.6498861202785164e-06,3.3962604659518443e-05,-1.1082692657354563e-06,1.0940117211766218e-07],[1.8090062322047945e-06,3.621708306781221e-06,1.1793189303956674e-06,1.6762921519460165e-06,-2.2916957177977975e-06,-1.9340582241084954e-07,-1.3355463561233198e-07,-1.7459950008448796e-07,-8.907038171734124e-07,-6.267210675728297e-07,-3.562599134118391e-07,-2.4150762714210922e-06,1.941915077501194e-08,-1.1082692657354563e-06,3.4251052684388666e-05,-2.3506757143962733e-06],[4.427680110287774e-06,2.6602567560958884e-06,1.9125171234042993e-06,-2.0951160126800587e-06,6.283231018415146e-07,-8.015655836608492e-07,5.922726855499028e-07,3.875292640968017e-07,-1.3609799606814917e-06,-1.135461610492227e-06,-1.0455305407828258e-07,-7.659669795890006e-07,-2.0754140674270867e-06,1.0940117211766218e-07,-2.3506757143962733e-06,3.6019198692354394e-05]],"coefficient_covariance_dimension":16,"coefficient_covariance_order":["sin_1","sin_2","sin_3","sin_4","sin_5","sin_6","sin_7","sin_8","cos_1","cos_2","cos_3","cos_4","cos_5","cos_6","cos_7","cos_8"],"cosine_coefficients":[-0.22271114586834734,0.039222699536290075,0.020566542627404247,-0.021681280631654767,0.005656417466067636,-0.003789740284478968,-0.008881393225467216,0.010159721738947343],"fundamental_frequency":1.951697440056053,"harmonic_count":8,"intercept":1.046373086131493,"metadata":{"catalog_period_days":0.5123745,"coefficient_covariance_order":"sine_1..sine_N,cosine_1..cosine_N","coefficient_snr":[26.76060716413396,9.871881704138035,4.4835466688091605,2.606454327166021,1.5468936385230734,2.19715788865217,1.7142923179264404,1.6123003671621017],"covariance_inflation":3.0103157980916784,"design_condition_number":1.6949694973130056,"effective_rank":17,"evidence_role":"exposed-development-only","extraction_model":"weighted_signed_harmonic_regression","family":"rr_lyrae","intercept":1.046373086131493,"intercept_variance":1.7532031178311724e-05,"mode":"RRab","normal_condition_number":2.8725297644367322,"period_evidence_grade":"EXTERNAL_CATALOG_CROSSCHECK","period_source":"OGLE LMC RR Lyrae catalog cross-check","phase":"11","phase_coverage":{"bins":12,"chi_square_uniform":7.6,"counts":[37,26,32,31,34,31,22,30,33,26,34,24],"maximum_circular_gap":0.013496963646957738,"occupancy_fraction":1.0,"occupied_bins":12},"physical_claim_scope":"waveform-only","reduced_chi_square":3.0103157980916784,"residual_rmse":0.07707280561066379,"ridge":0.0001,"sample_count":360,"weighted_chi_square":1032.5383187454456},"object_id":"OGLE-LMC-RRLYR-00004","reference_epoch":2171.86025,"schema_version":"DERD-HARMONIC-EXCHANGE-1.0","sine_coefficients":[0.02865099760602779,-0.07291720317313156,0.03146838230251401,-0.002843215765442715,-0.011680311679496461,0.01800151445021329,-0.011276256381962271,-0.008886012441163346],"source_locator":"https://github.com/bksim/OutlierDetection/blob/55836b58345b9507bfbd98c5fabbac82c83605e3/Cluster/rrlyr/phot/I/OGLE-LMC-RRLYR-00004.dat","source_sha256":"2fe24c62103faefdac684110dd6f89f1bccede7237485703b9c2d9f35a0c1405","time_unit":"day","value_unit":"relative_flux"}
