{"canonical_series":"y=c0+sum(c_n*exp(i*2*pi*n*f*(t-t0))+conjugate)","coefficient_covariance":[[3.448192010061276e-07,-2.552838463654304e-08,-1.5821842897619191e-09,-1.3534288330852657e-08,-1.2770727562478988e-08,-8.861030409585173e-09,4.0461232414074507e-08,2.010286010623012e-08,1.9891978603790387e-08,-3.2673468290878024e-08,-1.6705480584154277e-08,-3.8976609287970444e-10,2.676821847880104e-10,3.0225872827485274e-08,-4.215500572444894e-10,-1.7708084169631525e-08],[-2.552838463654304e-08,3.4313599093377235e-07,-4.11476299558669e-08,-1.2838263454594354e-08,-2.2971027261884343e-08,2.7969152143421385e-08,1.2196122289784508e-08,1.1933943843353874e-08,3.635326470708344e-09,2.1141066234028098e-09,-3.181723020481335e-08,-1.7426482317540332e-08,3.0852789509123295e-08,-4.639198564942097e-09,1.4827348039928428e-08,-2.3666251553769877e-08],[-1.5821842897619191e-09,-4.11476299558669e-08,3.3032660609674756e-07,-4.900051511883929e-08,2.7922277294376258e-08,-1.8047961281842485e-09,-2.1739548876963438e-09,-5.654450581616511e-09,2.3790212675121765e-08,4.804730470469863e-09,3.7164447150725314e-09,-4.5462114726553826e-10,-2.0984726180318893e-08,1.4007054342300362e-08,-2.5866467656207814e-08,2.3149870305660697e-08],[-1.3534288330852657e-08,-1.2838263454594354e-08,-4.900051511883929e-08,3.698353724754788e-07,-2.9187507814717245e-08,-2.3962823457202753e-09,-1.7355562074901965e-08,-1.1751520437877066e-09,-2.863819902018998e-08,2.2206792271989974e-08,3.273362623231824e-08,-1.1656707648255432e-09,-1.8740962818581567e-08,-4.032278072395336e-08,2.337322631973457e-08,-1.041715796629365e-08],[-1.2770727562478988e-08,-2.2971027261884343e-08,2.7922277294376258e-08,-2.9187507814717245e-08,3.413301797038419e-07,-4.509758310995162e-08,-4.3474258291457735e-09,-5.235234885624325e-09,7.305193494034237e-09,2.7661389698582555e-09,1.9891890670695665e-08,1.6537066435378805e-08,-2.013506414981114e-08,-7.803467005698549e-09,-2.785487949640229e-08,2.4552514002583016e-08],[-8.861030409585173e-09,2.7969152143421385e-08,-1.8047961281842485e-09,-2.3962823457202753e-09,-4.509758310995162e-08,3.3891531232311793e-07,-3.137693882445656e-08,-3.833048653153122e-09,1.4640112875504251e-09,4.133857463035035e-09,-1.583448132125285e-08,8.675167603749031e-10,2.5728514063663614e-08,-5.676681649373504e-09,-8.901555098555258e-09,-8.04475278289156e-09],[4.0461232414074507e-08,1.2196122289784508e-08,-2.1739548876963438e-09,-1.7355562074901965e-08,-4.3474258291457735e-09,-3.137693882445656e-08,3.3765587211373114e-07,-1.1088522894551852e-08,4.078015292176344e-09,-1.592615553048469e-08,-1.3712751875896955e-08,-5.9056312174184e-09,1.5854021441759275e-08,2.5828057929055842e-08,1.4097627587791805e-08,-2.600810021396567e-08],[2.010286010623012e-08,1.1933943843353874e-08,-5.654450581616511e-09,-1.1751520437877066e-09,-5.235234885624325e-09,-3.833048653153122e-09,-1.1088522894551852e-08,3.413924524779226e-07,1.3095674578712936e-08,-1.4203295796473375e-08,-4.792042857422229e-09,-4.752714761518383e-10,-2.8016237401853333e-09,3.109854443812183e-08,1.508058179940957e-08,-9.140807649295634e-09],[1.9891978603790387e-08,3.635326470708344e-09,2.3790212675121765e-08,-2.863819902018998e-08,7.305193494034237e-09,1.4640112875504251e-09,4.078015292176344e-09,1.3095674578712936e-08,3.6485211204907733e-07,-3.775752356791765e-08,2.2649350446596847e-08,1.4396186879080247e-09,3.6660172613195474e-08,2.3460708216427675e-08,8.832167644704457e-09,1.1336100791549677e-08],[-3.2673468290878024e-08,2.1141066234028098e-09,4.804730470469863e-09,2.2206792271989974e-08,2.7661389698582555e-09,4.133857463035035e-09,-1.592615553048469e-08,-1.4203295796473375e-08,-3.775752356791765e-08,3.6695852510114134e-07,-2.4814643863084456e-08,3.6162683130519855e-08,8.085855113489753e-09,-2.46816438056656e-09,-1.4479283474861668e-09,4.0220209829626264e-08],[-1.6705480584154277e-08,-3.181723020481335e-08,3.7164447150725314e-09,3.273362623231824e-08,1.9891890670695665e-08,-1.583448132125285e-08,-1.3712751875896955e-08,-4.792042857422229e-09,2.2649350446596847e-08,-2.4814643863084456e-08,3.772481687043928e-07,-1.6950641744246772e-08,-6.091682425700618e-09,-1.0187310186910127e-08,2.3626524850337445e-08,2.097171397569932e-08],[-3.8976609287970444e-10,-1.7426482317540332e-08,-4.5462114726553826e-10,-1.1656707648255432e-09,1.6537066435378805e-08,8.675167603749031e-10,-5.9056312174184e-09,-4.752714761518383e-10,1.4396186879080247e-09,3.6162683130519855e-08,-1.6950641744246772e-08,3.375676851898638e-07,-3.729343334379439e-08,2.415495966192961e-08,4.8801327209421185e-09,2.669208692079306e-08],[2.676821847880104e-10,3.0852789509123295e-08,-2.0984726180318893e-08,-1.8740962818581567e-08,-2.013506414981114e-08,2.5728514063663614e-08,1.5854021441759275e-08,-2.8016237401853333e-09,3.6660172613195474e-08,8.085855113489753e-09,-6.091682425700618e-09,-3.729343334379439e-08,3.6567833217967185e-07,-1.989994346375919e-08,2.4499968777073784e-08,-5.989625035824586e-09],[3.0225872827485274e-08,-4.639198564942097e-09,1.4007054342300362e-08,-4.032278072395336e-08,-7.803467005698549e-09,-5.676681649373504e-09,2.5828057929055842e-08,3.109854443812183e-08,2.3460708216427675e-08,-2.46816438056656e-09,-1.0187310186910127e-08,2.415495966192961e-08,-1.989994346375919e-08,3.68760834186782e-07,-3.39158112442062e-08,2.4624496628694908e-08],[-4.215500572444894e-10,1.4827348039928428e-08,-2.5866467656207814e-08,2.337322631973457e-08,-2.785487949640229e-08,-8.901555098555258e-09,1.4097627587791805e-08,1.508058179940957e-08,8.832167644704457e-09,-1.4479283474861668e-09,2.3626524850337445e-08,4.8801327209421185e-09,2.4499968777073784e-08,-3.39158112442062e-08,3.701810151490354e-07,-5.533400552262292e-08],[-1.7708084169631525e-08,-2.3666251553769877e-08,2.3149870305660697e-08,-1.041715796629365e-08,2.4552514002583016e-08,-8.04475278289156e-09,-2.600810021396567e-08,-9.140807649295634e-09,1.1336100791549677e-08,4.0220209829626264e-08,2.097171397569932e-08,2.669208692079306e-08,-5.989625035824586e-09,2.4624496628694908e-08,-5.533400552262292e-08,3.5863184660867544e-07]],"coefficient_covariance_dimension":16,"coefficient_covariance_order":["sin_1","sin_2","sin_3","sin_4","sin_5","sin_6","sin_7","sin_8","cos_1","cos_2","cos_3","cos_4","cos_5","cos_6","cos_7","cos_8"],"cosine_coefficients":[-0.11169440605255862,0.0073302026558606315,-0.0018487336000091164,0.0017502042435151317,0.000674605091489756,0.00011139834497589366,-0.0008517568093613098,-0.00015631501537703197],"fundamental_frequency":0.38977460620779203,"harmonic_count":8,"intercept":1.006667243933718,"metadata":{"catalog_period_days":2.5655853,"coefficient_covariance_order":"sine_1..sine_N,cosine_1..cosine_N","coefficient_snr":[133.34775004104384,10.81437036714682,2.822444781503572,2.168634360812746,1.204059560189355,0.9410734177625241,1.314776528553524,0.6861903171234279],"covariance_inflation":2.7747970705019096,"design_condition_number":1.8284645922249894,"effective_rank":17,"evidence_role":"exposed-development-only","extraction_model":"weighted_signed_harmonic_regression","family":"classical_cepheid","intercept":1.006667243933718,"intercept_variance":1.778156101153744e-07,"mode":"1O","normal_condition_number":3.3427711439563317,"period_evidence_grade":"EXTERNAL_CATALOG_MIRROR","period_source":"dubbatee/ScienceExtensionCode@2d5f05d5c20d8c4c1c1e8811d502398232f14316","phase_coverage":{"bins":12,"chi_square_uniform":8.258064516129032,"counts":[30,30,23,29,36,30,24,33,34,36,39,28],"maximum_circular_gap":0.01784076327544426,"occupancy_fraction":1.0,"occupied_bins":12},"physical_claim_scope":"waveform-only","reduced_chi_square":2.7747970705019096,"residual_rmse":0.007809981548998628,"ridge":0.0001,"sample_count":372,"weighted_chi_square":985.0529600281778},"object_id":"OGLE-LMC-CEP-0010","reference_epoch":2162.88312,"schema_version":"DERD-HARMONIC-EXCHANGE-1.0","sine_coefficients":[-0.011977771183684592,-0.005414250945649778,-0.0014895846357762797,-0.0005135016987959245,0.0007549173622517858,0.0007837869453043224,-0.0007057645482217475,-0.0005524283331674243],"source_locator":"https://github.com/bksim/OutlierDetection/blob/55836b58345b9507bfbd98c5fabbac82c83605e3/Cluster/cep/phot/I/OGLE-LMC-CEP-0010.dat","source_sha256":"574d7252996f5ee71169a97f2d7b52a8acbdb0898df65a7b61f5419ae9f063e0","time_unit":"day","value_unit":"relative_flux"}
