{"canonical_series":"y=c0+sum(c_n*exp(i*2*pi*n*f*(t-t0))+conjugate)","coefficient_covariance":[[9.300877334874389e-05,-3.203395261789891e-05,-1.81170547678191e-05,4.1215191225417246e-05,0.00014166245080289596,7.308954521143403e-05,-9.593969603540257e-06,-0.00011673055392820012,3.7264123870240075e-05,-6.575338718062897e-06,-2.4823712107042044e-05,-0.00011077110193465528,2.6570887119989902e-05,6.608108558298783e-05,0.00014300295944050622,-4.7989306161472386e-05],[-3.203395261789891e-05,6.165092356484124e-05,-4.058600088313999e-05,-8.966315392383009e-06,-4.647908607249998e-05,2.8179876980840404e-07,-3.9038017021999005e-05,7.700293906903863e-05,-7.594005122527465e-05,5.6197153899458326e-05,-2.4756403951211877e-06,3.235423926886024e-05,-4.0422732451790057e-05,2.0262442927065227e-05,-6.75392126985308e-05,2.0119089042710178e-05],[-1.81170547678191e-05,-4.058600088313999e-05,9.82618343908716e-05,-3.0346477779829352e-05,-3.7154672674066504e-05,-6.347631659677436e-05,8.93014773380965e-05,-3.822394242258057e-06,6.939328694474347e-05,-0.00010115836911967377,2.9789077356630835e-05,3.4354684511960606e-05,3.730596017985798e-05,-7.80240876450356e-05,-1.7124508419662796e-05,4.446516769231937e-05],[4.1215191225417246e-05,-8.966315392383009e-06,-3.0346477779829352e-05,0.00011502872117179475,3.596129978552449e-05,9.884572435062465e-05,-3.900520251547178e-05,-6.293519560639554e-05,-6.211078011535753e-05,3.107517295154706e-05,-0.00011313325379686445,-3.041114646089327e-05,7.749672604112654e-06,6.148239291927751e-05,0.00013162467668725216,7.064918240436684e-06],[0.00014166245080289596,-4.647908607249998e-05,-3.7154672674066504e-05,3.596129978552449e-05,0.000444773035837267,9.710527374607942e-05,-4.067584139062853e-05,-0.0002583976381593328,9.550932389020206e-05,-8.438558362764532e-05,2.2127868933783457e-05,-0.0003415133224139949,8.354910864724879e-05,0.00021574657439194455,0.0002949581913889314,-9.936831037892001e-05],[7.308954521143403e-05,2.8179876980840404e-07,-6.347631659677436e-05,9.884572435062465e-05,9.710527374607942e-05,0.00013909137138424631,-7.429160167137075e-05,-8.360988129423264e-05,-5.485942914817671e-05,6.849764110519095e-05,-9.590514428346081e-05,-7.298539228378e-05,-1.1036438612501263e-05,0.00010566149112224064,0.00014238433793414118,-4.0432205730496504e-05],[-9.593969603540257e-06,-3.9038017021999005e-05,8.93014773380965e-05,-3.900520251547178e-05,-4.067584139062853e-05,-7.429160167137075e-05,0.000130544581666027,-2.162073377322588e-05,0.00010998302350075091,-8.6251888977498e-05,7.14123775130956e-05,3.19217317470655e-05,5.661495758741154e-05,-0.0001396579719905582,-3.438255070993241e-05,-5.877581709827992e-06],[-0.00011673055392820012,7.700293906903863e-05,-3.822394242258057e-06,-6.293519560639554e-05,-0.0002583976381593328,-8.360988129423264e-05,-2.162073377322588e-05,0.00024106451364001288,-0.00010302215328124848,7.918854508697273e-05,1.8546211391491156e-05,0.0002098149426952481,-9.40543873621504e-05,-8.012610504437662e-05,-0.00026654330166542056,7.604302557316359e-05],[3.7264123870240075e-05,-7.594005122527465e-05,6.939328694474347e-05,-6.211078011535753e-05,9.550932389020206e-05,-5.485942914817671e-05,0.00010998302350075091,-0.00010302215328124848,0.00020610368026287944,-8.482174984099113e-05,0.00012125009789678208,-6.14445486117491e-05,7.54925951162879e-05,-0.00010457132227496314,1.0463212096198682e-05,-0.00011408679662850703],[-6.575338718062897e-06,5.6197153899458326e-05,-0.00010115836911967377,3.107517295154706e-05,-8.438558362764532e-05,6.849764110519095e-05,-8.6251888977498e-05,7.918854508697273e-05,-8.482174984099113e-05,0.00018159472621618559,-2.8004952631241467e-05,7.200537946423553e-05,-7.775371943543947e-05,4.764820852314056e-06,-9.213448741266571e-05,-6.95458056578076e-05],[-2.4823712107042044e-05,-2.4756403951211877e-06,2.9789077356630835e-05,-0.00011313325379686445,2.2127868933783457e-05,-9.590514428346081e-05,7.14123775130956e-05,1.8546211391491156e-05,0.00012125009789678208,-2.8004952631241467e-05,0.0001728725144668777,-8.953151224112804e-06,1.7010954527313335e-05,-9.804443322226932e-05,-0.00013267128832179692,-7.983277324120775e-05],[-0.00011077110193465528,3.235423926886024e-05,3.4354684511960606e-05,-3.041114646089327e-05,-0.0003415133224139949,-7.298539228378e-05,3.19217317470655e-05,0.0002098149426952481,-6.14445486117491e-05,7.200537946423553e-05,-8.953151224112804e-06,0.0002839057300166309,-7.207561203088668e-05,-0.0001811096388278869,-0.00025043103448481346,6.157238813965139e-05],[2.6570887119989902e-05,-4.0422732451790057e-05,3.730596017985798e-05,7.749672604112654e-06,8.354910864724879e-05,-1.1036438612501263e-05,5.661495758741154e-05,-9.40543873621504e-05,7.54925951162879e-05,-7.775371943543947e-05,1.7010954527313335e-05,-7.207561203088668e-05,6.817073374513791e-05,-1.6016770003633504e-05,8.472171425114284e-05,-1.6274990517760268e-05],[6.608108558298783e-05,2.0262442927065227e-05,-7.80240876450356e-05,6.148239291927751e-05,0.00021574657439194455,0.00010566149112224064,-0.0001396579719905582,-8.012610504437662e-05,-0.00010457132227496314,4.764820852314056e-06,-9.804443322226932e-05,-0.0001811096388278869,-1.6016770003633504e-05,0.00026525094326018304,0.0001922667451549228,3.9311236637871757e-05],[0.00014300295944050622,-6.75392126985308e-05,-1.7124508419662796e-05,0.00013162467668725216,0.0002949581913889314,0.00014238433793414118,-3.438255070993241e-05,-0.00026654330166542056,1.0463212096198682e-05,-9.213448741266571e-05,-0.00013267128832179692,-0.00025043103448481346,8.472171425114284e-05,0.0001922667451549228,0.0004064736803541749,3.329730088929357e-06],[-4.7989306161472386e-05,2.0119089042710178e-05,4.446516769231937e-05,7.064918240436684e-06,-9.936831037892001e-05,-4.0432205730496504e-05,-5.877581709827992e-06,7.604302557316359e-05,-0.00011408679662850703,-6.95458056578076e-05,-7.983277324120775e-05,6.157238813965139e-05,-1.6274990517760268e-05,3.9311236637871757e-05,3.329730088929357e-06,0.00019426429189490116]],"coefficient_covariance_dimension":16,"coefficient_covariance_order":["sin_1","sin_2","sin_3","sin_4","sin_5","sin_6","sin_7","sin_8","cos_1","cos_2","cos_3","cos_4","cos_5","cos_6","cos_7","cos_8"],"cosine_coefficients":[0.11906619644945715,-0.056307299086757585,-0.0050441704346938345,0.007066608415391965,-0.002402519321843229,0.0005749468888617473,0.004099453372733287,0.006230836109445939],"fundamental_frequency":0.32070308378464274,"harmonic_count":8,"intercept":1.0044882238389934,"metadata":{"band":"V","claim_boundary":"signed harmonic and passband-shape evidence only","coefficient_covariance_order":["sin_1","sin_2","sin_3","sin_4","sin_5","sin_6","sin_7","sin_8","cos_1","cos_2","cos_3","cos_4","cos_5","cos_6","cos_7","cos_8"],"covariance_estimator":"hc3","design_condition_number":7.625326505161201,"fit_domain":"flux","input_domain":"magnitude","intercept":1.0044882238389934,"observation_count":33,"period_days":3.1181490000000003,"phase":20,"phase_coverage":{"bin_count":12,"bin_counts":[6,4,5,2,3,1,1,2,3,3,2,1],"maximum_bin_count":6,"maximum_circular_phase_gap":0.09536779672805551,"median_circular_phase_gap":0.01983356151362159,"minimum_bin_count":1,"occupied_bins":12},"reference_epoch_policy":"explicit","residual_rmse":0.007597641452082555,"ridge":0.0001,"scope":"ogleiii_v","weighted_reduced_chi_square":3.6622420659443056},"object_id":"OGLE-LMC-CEP-0002","reference_epoch":2171.85654,"schema_version":"DERD-HARMONIC-EXCHANGE-1.0","sine_coefficients":[-0.13200840529647592,-0.03195353605398766,0.023599992479324712,-0.004369387808970774,-0.003624661503316327,-0.006033596453200832,-0.0027647266183379636,0.00023912185029152576],"source_locator":"https://www.astrouw.edu.pl/ogle/ogle3/OIII-CVS/lmc/cep/phot/V/OGLE-LMC-CEP-0002.dat","source_sha256":"bc36f947e8e3d36d197498345b83aa24f9e1a0d9010a99f4fe8a0bab4ccdb855","time_unit":"day","value_unit":"relative_flux"}
