{"canonical_series":"y=c0+sum(c_n*exp(i*2*pi*n*f*(t-t0))+conjugate)","coefficient_covariance":[[3.2320012370127637e-07,-7.255917794817868e-08,3.923256951759562e-08,4.2579248424690044e-08,-2.844107501783041e-08,-3.397075148801438e-09,4.9299310114773874e-08,-1.4375502330747945e-08,2.9405974139185814e-09,2.9257630581601668e-08,-1.7240060300023815e-08,-2.2305542374269966e-08,4.4390994573792965e-08,-2.6091970488912913e-08,-1.9600073326973925e-08,3.4420975562523954e-08],[-7.255917794817868e-08,3.689318025351931e-07,-2.3215498106299766e-08,9.848034705798453e-09,4.2566137803128655e-08,1.1685886823674445e-08,-1.172987811103491e-08,1.4745242093115409e-08,6.178582708516236e-08,-1.8120928812026694e-08,-2.4517536531516395e-09,2.280296056488868e-08,-5.719534842621035e-08,1.760135622247761e-08,1.046464473165269e-08,-4.0678679579707433e-08],[3.923256951759562e-08,-2.3215498106299766e-08,3.418914533592225e-07,-2.514894504721683e-08,5.917973469617332e-08,2.768276661067509e-08,-2.6546189061048373e-08,-3.944581719988377e-08,-1.6319044517901682e-08,3.6005353015119194e-08,2.7653685943226733e-08,-3.668934806565876e-08,-5.373106426226707e-09,-2.5526418174333906e-08,-7.0738826502053004e-09,2.635578624638664e-10],[4.2579248424690044e-08,9.848034705798453e-09,-2.514894504721683e-08,3.915402318432972e-07,-3.978730348130177e-08,2.7737470375281252e-08,-7.959463899605395e-10,-4.7535508129570436e-08,5.982832663216805e-08,3.600082566133063e-08,5.086662389948231e-09,3.2890540607887757e-09,1.0945119380983206e-09,-3.2919975791048035e-08,-3.4392710180013383e-08,4.257293279147829e-08],[-2.844107501783041e-08,4.2566137803128655e-08,5.917973469617332e-08,-3.978730348130177e-08,3.5491488765355616e-07,-6.549634610061415e-08,1.1169228169887657e-08,2.729465052152537e-08,7.3763068745054485e-09,2.522569614342138e-08,5.80726715370455e-09,3.716936515785835e-08,-2.2858398655925714e-08,-7.78915549607754e-09,1.520472599581528e-08,-4.5591908165659646e-08],[-3.397075148801438e-09,1.1685886823674445e-08,2.768276661067509e-08,2.7737470375281252e-08,-6.549634610061415e-08,3.4329125900386185e-07,-4.560882892953599e-08,2.1382226037332453e-08,2.6995396597006364e-09,-1.2472559655272922e-08,6.609694146715324e-08,-1.3799562955335914e-08,3.29757199369061e-08,2.3306011792106206e-08,-2.6309697192744714e-08,2.1720890817500337e-08],[4.9299310114773874e-08,-1.172987811103491e-08,-2.6546189061048373e-08,-7.959463899605395e-10,1.1169228169887657e-08,-4.560882892953599e-08,3.5925574578905394e-07,-1.5836483726000256e-08,2.6990029577160817e-08,3.041205974846409e-08,-3.796777785840226e-08,5.646378425101511e-08,3.198950448170929e-08,1.9700104005300617e-08,3.893630866891913e-08,-4.783638734363413e-08],[-1.4375502330747945e-08,1.4745242093115409e-08,-3.944581719988377e-08,-4.7535508129570436e-08,2.729465052152537e-08,2.1382226037332453e-08,-1.5836483726000256e-08,3.7499691540153744e-07,7.893988085617727e-09,2.5712639672958504e-09,2.7981614420090975e-08,8.847743555496467e-09,4.183144951375885e-08,4.796683303889676e-08,6.604208237993457e-09,3.1651072559585174e-09],[2.9405974139185814e-09,6.178582708516236e-08,-1.6319044517901682e-08,5.982832663216805e-08,7.3763068745054485e-09,2.6995396597006364e-09,2.6990029577160817e-08,7.893988085617727e-09,3.7754056961864224e-07,-2.7637258213332237e-08,1.3955014065717388e-08,-2.8693802660969525e-09,2.322686134539157e-09,-4.0213161759760634e-08,-1.2962280921301852e-08,-2.9114732493146652e-08],[2.9257630581601668e-08,-1.8120928812026694e-08,3.6005353015119194e-08,3.600082566133063e-08,2.522569614342138e-08,-1.2472559655272922e-08,3.041205974846409e-08,2.5712639672958504e-09,-2.7637258213332237e-08,3.419590054468707e-07,-7.455110064613115e-08,4.1156378022269194e-08,4.529222743188951e-09,-5.113665064875703e-08,-2.9328738211053763e-08,1.7143891267975615e-08],[-1.7240060300023815e-08,-2.4517536531516395e-09,2.7653685943226733e-08,5.086662389948231e-09,5.80726715370455e-09,6.609694146715324e-08,-3.796777785840226e-08,2.7981614420090975e-08,1.3955014065717388e-08,-7.455110064613115e-08,3.697239102699051e-07,-6.539655654203075e-08,-3.5082369421391555e-09,1.9046944496069144e-08,-2.347426972358782e-08,6.495278190365439e-11],[-2.2305542374269966e-08,2.280296056488868e-08,-3.668934806565876e-08,3.2890540607887757e-09,3.716936515785835e-08,-1.3799562955335914e-08,5.646378425101511e-08,8.847743555496467e-09,-2.8693802660969525e-09,4.1156378022269194e-08,-6.539655654203075e-08,3.2654252847844065e-07,-4.81827168139074e-08,3.447205412868282e-08,4.133280798787322e-08,-9.139885893842118e-09],[4.4390994573792965e-08,-5.719534842621035e-08,-5.373106426226707e-09,1.0945119380983206e-09,-2.2858398655925714e-08,3.29757199369061e-08,3.198950448170929e-08,4.183144951375885e-08,2.322686134539157e-09,4.529222743188951e-09,-3.5082369421391555e-09,-4.81827168139074e-08,3.686040098889293e-07,-2.7645428621774522e-08,5.3662810806424336e-08,1.1470836116247286e-08],[-2.6091970488912913e-08,1.760135622247761e-08,-2.5526418174333906e-08,-3.2919975791048035e-08,-7.78915549607754e-09,2.3306011792106206e-08,1.9700104005300617e-08,4.796683303889676e-08,-4.0213161759760634e-08,-5.113665064875703e-08,1.9046944496069144e-08,3.447205412868282e-08,-2.7645428621774522e-08,3.943070437344648e-07,-5.8055635125474815e-08,3.9781441776571495e-08],[-1.9600073326973925e-08,1.046464473165269e-08,-7.0738826502053004e-09,-3.4392710180013383e-08,1.520472599581528e-08,-2.6309697192744714e-08,3.893630866891913e-08,6.604208237993457e-09,-1.2962280921301852e-08,-2.9328738211053763e-08,-2.347426972358782e-08,4.133280798787322e-08,5.3662810806424336e-08,-5.8055635125474815e-08,3.816685415121849e-07,-8.194777609575829e-08],[3.4420975562523954e-08,-4.0678679579707433e-08,2.635578624638664e-10,4.257293279147829e-08,-4.5591908165659646e-08,2.1720890817500337e-08,-4.783638734363413e-08,3.1651072559585174e-09,-2.9114732493146652e-08,1.7143891267975615e-08,6.495278190365439e-11,-9.139885893842118e-09,1.1470836116247286e-08,3.9781441776571495e-08,-8.194777609575829e-08,3.4636206512223295e-07]],"coefficient_covariance_dimension":16,"coefficient_covariance_order":["sin_1","sin_2","sin_3","sin_4","sin_5","sin_6","sin_7","sin_8","cos_1","cos_2","cos_3","cos_4","cos_5","cos_6","cos_7","cos_8"],"cosine_coefficients":[-0.11162571211077683,0.007415552502542239,-0.0017770746674626182,0.001739107065340216,0.0006584385976238417,8.528936160860255e-05,-0.0008185345070068888,-8.566957299777481e-05],"fundamental_frequency":0.38977570967090225,"harmonic_count":8,"intercept":1.0066765208435653,"metadata":{"band":"I","catalog_period_days":2.5655853,"coefficient_covariance_order":["sin_1","sin_2","sin_3","sin_4","sin_5","sin_6","sin_7","sin_8","cos_1","cos_2","cos_3","cos_4","cos_5","cos_6","cos_7","cos_8"],"covariance_estimator":"hc3","design_condition_number":1.828138992893719,"evidence_role":"exposed-development-only","fit_domain":"flux","input_domain":"magnitude","intercept":1.0066765208435653,"mode":"1O","observation_count":372,"period_coordinate":"generic_harmonic_profile_minimum","period_days":2.565578036774857,"period_profile":{"best_chi_square":982.7419813082082,"best_period_days":2.565578036774857,"catalog_chi_square":985.0517807361559,"catalog_period_days":2.5655853,"grid_count":201,"profile_half_width_days":7.696755899733176e-06,"profile_lower_days":2.56557041960526,"profile_upper_days":2.5655858131170595,"reduced_chi_square_at_best":2.768287271290727,"relative_delta":-2.831020719952658e-06,"relative_span":0.0002,"resolved":true},"period_source_commit":"2d5f05d5c20d8c4c1c1e8811d502398232f14316","period_source_repository":"dubbatee/ScienceExtensionCode","phase_coverage":{"bin_count":12,"bin_counts":[28,31,24,28,37,30,24,33,34,36,39,28],"maximum_bin_count":39,"maximum_circular_phase_gap":0.018576881254148248,"median_circular_phase_gap":0.0018724769908828875,"minimum_bin_count":24,"occupied_bins":12},"physical_claim_scope":"waveform-only","reference_epoch_policy":"minimum_observation_time","residual_rmse":0.0078113914857576155,"ridge":1e-08,"rights_status":"PUBLIC_MIRROR; REDISTRIBUTION_TERMS_NOT_VERIFIED","source_blob_sha":"fd82c05bb3a62ba9a8c614ac51eb315124090381","source_commit":"55836b58345b9507bfbd98c5fabbac82c83605e3","source_git_blob_verified":true,"source_repository":"bksim/OutlierDetection","weighted_reduced_chi_square":2.768287271290727},"object_id":"OGLE-LMC-CEP-0010","reference_epoch":2162.88312,"schema_version":"DERD-HARMONIC-EXCHANGE-1.0","sine_coefficients":[-0.01288419315858826,-0.005322314529557481,-0.001567512788045001,-0.00040256022763694434,0.0007829843838037355,0.0007824557678201171,-0.0007170471355158786,-0.0005026395130793214],"source_locator":"https://github.com/bksim/OutlierDetection/blob/55836b58345b9507bfbd98c5fabbac82c83605e3/Cluster/cep/phot/I/OGLE-LMC-CEP-0010.dat","source_sha256":"574d7252996f5ee71169a97f2d7b52a8acbdb0898df65a7b61f5419ae9f063e0","time_unit":"day","value_unit":"relative_flux"}
