{"canonical_series":"y=c0+sum(c_n*exp(i*2*pi*n*f*(t-t0))+conjugate)","coefficient_covariance":[[3.571623283213946e-07,2.8395816884740557e-08,1.2608654925384044e-08,-1.473004555158914e-08,-2.2026374706053705e-08,-3.850383944258396e-08,2.4304969540589594e-08,4.185882013650824e-08,1.121876439266489e-08,-1.9046062675906044e-08,-2.2956485320580057e-08,-1.8703091731560663e-08,9.674369574416243e-09,-1.0223282439009e-08,-1.0925459900863353e-11,5.9865160584400345e-09],[2.8395816884740557e-08,3.613940158923975e-07,1.0759505098743047e-08,-8.277909882946652e-09,-4.938684247899688e-08,5.7689769587373735e-09,3.0390207118616463e-09,1.0149612625528076e-08,4.2509741132030984e-08,-1.028695173508482e-08,-4.0051540848594114e-08,-1.4446575938042836e-08,-2.6893590585239042e-08,9.74529908706952e-09,-3.202618693796917e-09,9.190792887785487e-09],[1.2608654925384044e-08,1.0759505098743047e-08,3.454855165386963e-07,-2.3602600075487584e-08,1.7112366277709266e-08,-1.0437110534360877e-08,-1.0335223134105586e-08,2.7162552570411044e-08,-5.763134848866705e-10,2.4691604435862085e-08,-4.407877248298105e-09,-5.007047576785868e-08,-1.0666934452859641e-08,-2.078829762396616e-08,2.5668981859651644e-08,8.267158947236261e-09],[-1.473004555158914e-08,-8.277909882946652e-09,-2.3602600075487584e-08,3.711205872501843e-07,1.6641799002017153e-08,2.5478087925234823e-09,1.3600799792138822e-08,-3.6016982616779034e-09,4.548349743186095e-09,7.086291931147058e-09,1.3087459307706278e-08,-1.498347145782081e-09,-4.1218775041932695e-08,4.614800132611066e-09,-6.8987788902467515e-09,2.0265444932797666e-08],[-2.2026374706053705e-08,-4.938684247899688e-08,1.7112366277709266e-08,1.6641799002017153e-08,3.567443150987152e-07,4.038709442774695e-08,9.24128253736982e-09,-1.7130955553975574e-08,-1.3833467539414338e-08,-7.592833995143762e-09,8.840281044623766e-09,2.1081113889033494e-08,1.2654912494915723e-08,-2.6568160474195416e-08,-3.711148804685882e-10,-4.699584009425576e-10],[-3.850383944258396e-08,5.7689769587373735e-09,-1.0437110534360877e-08,2.5478087925234823e-09,4.038709442774695e-08,3.632138880127724e-07,1.0155700637375396e-08,-1.289206761704659e-08,-2.5285603845681587e-08,-1.3910414290113054e-08,1.4931659293759927e-09,2.3621056921387367e-08,3.3111891426184456e-08,8.442772240159879e-09,-2.2872931630802304e-08,-2.2414177545822583e-08],[2.4304969540589594e-08,3.0390207118616463e-09,-1.0335223134105586e-08,1.3600799792138822e-08,9.24128253736982e-09,1.0155700637375396e-08,3.410742969623998e-07,-3.301270815115511e-09,-3.4254216808485293e-09,-1.7606295350886033e-08,2.6587827112376087e-09,1.4719173635975691e-08,1.7348259699761655e-08,3.726598887237815e-08,-1.6850358907357102e-08,-3.285130714751466e-08],[4.185882013650824e-08,1.0149612625528076e-08,2.7162552570411044e-08,-3.6016982616779034e-09,-1.7130955553975574e-08,-1.289206761704659e-08,-3.301270815115511e-09,3.4983445172184503e-07,-3.082895491001158e-08,1.3252169753338394e-08,-2.2443715451315163e-09,-2.113982217430414e-09,1.9412895337309887e-08,-8.713193291654354e-09,2.570582248347582e-08,-1.6011825913797512e-08],[1.121876439266489e-08,4.2509741132030984e-08,-5.763134848866705e-10,4.548349743186095e-09,-1.3833467539414338e-08,-2.5285603845681587e-08,-3.4254216808485293e-09,-3.082895491001158e-08,3.5822764361847426e-07,-3.532555879824959e-09,-1.0892745544961958e-08,-1.5214168422494522e-08,-3.0002786460327896e-09,3.6413421540766925e-08,-5.8603892399796234e-09,3.4520810457154595e-08],[-1.9046062675906044e-08,-1.028695173508482e-08,2.4691604435862085e-08,7.086291931147058e-09,-7.592833995143762e-09,-1.3910414290113054e-08,-1.7606295350886033e-08,1.3252169753338394e-08,-3.532555879824959e-09,3.445594859342416e-07,1.2800798149676393e-08,1.051239623286816e-08,2.1537798787056797e-08,-2.7755948281978086e-08,-5.082984446673886e-09,7.597785003656318e-09],[-2.2956485320580057e-08,-4.0051540848594114e-08,-4.407877248298105e-09,1.3087459307706278e-08,8.840281044623766e-09,1.4931659293759927e-09,2.6587827112376087e-09,-2.2443715451315163e-09,-1.0892745544961958e-08,1.2800798149676393e-08,3.648494216978559e-07,4.892706340776152e-08,-1.442439939727757e-08,-1.9442604208595234e-08,-1.4469792154712622e-08,-3.111687632742608e-08],[-1.8703091731560663e-08,-1.4446575938042836e-08,-5.007047576785868e-08,-1.498347145782081e-09,2.1081113889033494e-08,2.3621056921387367e-08,1.4719173635975691e-08,-2.113982217430414e-09,-1.5214168422494522e-08,1.051239623286816e-08,4.892706340776152e-08,3.3993993818898e-07,8.558920768871023e-09,-1.2397773932698574e-09,-4.423010161109401e-08,-2.1218316690289057e-08],[9.674369574416243e-09,-2.6893590585239042e-08,-1.0666934452859641e-08,-4.1218775041932695e-08,1.2654912494915723e-08,3.3111891426184456e-08,1.7348259699761655e-08,1.9412895337309887e-08,-3.0002786460327896e-09,2.1537798787056797e-08,-1.442439939727757e-08,8.558920768871023e-09,3.532888770076669e-07,-1.617040083918734e-08,-7.336746504552159e-09,-1.1562487718465606e-08],[-1.0223282439009e-08,9.74529908706952e-09,-2.078829762396616e-08,4.614800132611066e-09,-2.6568160474195416e-08,8.442772240159879e-09,3.726598887237815e-08,-8.713193291654354e-09,3.6413421540766925e-08,-2.7755948281978086e-08,-1.9442604208595234e-08,-1.2397773932698574e-09,-1.617040083918734e-08,3.4763821956398763e-07,1.5398914711211817e-08,1.5907070458110587e-08],[-1.0925459900863353e-11,-3.202618693796917e-09,2.5668981859651644e-08,-6.8987788902467515e-09,-3.711148804685882e-10,-2.2872931630802304e-08,-1.6850358907357102e-08,2.570582248347582e-08,-5.8603892399796234e-09,-5.082984446673886e-09,-1.4469792154712622e-08,-4.423010161109401e-08,-7.336746504552159e-09,1.5398914711211817e-08,3.7098503460791613e-07,2.8304568667669567e-08],[5.9865160584400345e-09,9.190792887785487e-09,8.267158947236261e-09,2.0265444932797666e-08,-4.699584009425576e-10,-2.2414177545822583e-08,-3.285130714751466e-08,-1.6011825913797512e-08,3.4520810457154595e-08,7.597785003656318e-09,-3.111687632742608e-08,-2.1218316690289057e-08,-1.1562487718465606e-08,1.5907070458110587e-08,2.8304568667669567e-08,3.5803969734871797e-07]],"coefficient_covariance_dimension":16,"coefficient_covariance_order":["sin_1","sin_2","sin_3","sin_4","sin_5","sin_6","sin_7","sin_8","cos_1","cos_2","cos_3","cos_4","cos_5","cos_6","cos_7","cos_8"],"cosine_coefficients":[-0.012877351604408711,-0.008427940143122705,-0.0005613732445538806,-8.124582837039406e-06,0.00022918199956890002,-0.0009351341022827359,0.0016219230882641722,-0.0007314258935834989],"fundamental_frequency":0.44850319906119307,"harmonic_count":8,"intercept":0.9974268949994332,"metadata":{"catalog_period_days":2.2296385,"coefficient_covariance_order":"sine_1..sine_N,cosine_1..cosine_N","coefficient_snr":[131.69705130137345,21.45169080737294,1.2952941315106028,1.7472110799305323,0.28858781786274573,1.1459349999465656,2.131259973319105,1.2465340871937198],"covariance_inflation":2.0634138363654952,"design_condition_number":1.8587073125338471,"effective_rank":17,"evidence_role":"exposed-development-only","extraction_model":"weighted_signed_harmonic_regression","family":"classical_cepheid","intercept":0.9974268949994332,"intercept_variance":1.7892814056568736e-07,"mode":"1O","normal_condition_number":3.454258972150848,"original_object_id_withheld":true,"original_source_locator_withheld":true,"period_evidence_grade":"EXTERNAL_CATALOG_MIRROR","period_source":"dubbatee/ScienceExtensionCode@2d5f05d5c20d8c4c1c1e8811d502398232f14316","phase":"11","phase19_blinded_control":true,"phase_coverage":{"bins":12,"chi_square_uniform":6.700272479564033,"counts":[27,27,31,37,36,30,31,37,25,32,29,25],"maximum_circular_gap":0.022349362912450488,"occupancy_fraction":1.0,"occupied_bins":12},"physical_claim_scope":"waveform-only","reduced_chi_square":2.0634138363654952,"residual_rmse":0.007872414283201682,"ridge":0.0001,"sample_count":367,"weighted_chi_square":722.1948427279233},"object_id":"P19-E2710C","reference_epoch":2171.85654,"schema_version":"DERD-HARMONIC-EXCHANGE-1.0","sine_coefficients":[0.11064347499075343,0.015932106101290738,0.0009362962806396573,0.0014733029432531378,-8.129732301104371e-05,0.0002428821883783384,0.0007770010143555367,0.0007516278655670086],"source_locator":"phase19:blinded-derived-control:P19-E2710C","source_sha256":"89e2be3447638bfaa07de72340d7fa89336a14ed00c67dc2e68e92a0b5122dae","time_unit":"day","value_unit":"relative_flux"}
