{"canonical_series":"y=c0+sum(c_n*exp(i*2*pi*n*f*(t-t0))+conjugate)","coefficient_covariance":[[2.887397569558191e-05,7.581271574663626e-07,-7.076024823495645e-07,8.233475355965699e-07,1.263912310685817e-06,-5.149186008451908e-07,-7.634472718467057e-07,-1.3206605127402331e-06,7.875936125825766e-07,-2.3360090480436999e-07,-1.0027201554863186e-06,6.872592667652936e-07,-6.026033364877671e-07,4.2760470574288703e-07,1.7765783294070405e-06,-1.7564232387905573e-08],[7.581271574663626e-07,2.818869749030732e-05,1.3816002909340178e-06,3.746210190683226e-07,7.040529849921694e-08,2.565344108659552e-07,-1.8553309153421774e-06,6.788050231651385e-07,-1.0445766391037384e-06,-1.6632642964977067e-07,4.367098667001207e-07,-1.6520668729734064e-06,9.37858369622249e-07,1.1285780675636668e-06,4.588544133046915e-07,2.1246135912043567e-06],[-7.076024823495645e-07,1.3816002909340178e-06,2.9374933071794732e-05,7.715229757141223e-07,-3.6432133497661077e-07,-1.2933710492821707e-06,1.7542817153138252e-06,-1.3452206944871466e-06,8.613706378269227e-07,-4.644481614624931e-07,-8.653914942585443e-07,8.05495508366179e-07,-8.525714555277447e-08,1.188905008095886e-06,1.3838305299639564e-06,1.1393601100398791e-06],[8.233475355965699e-07,3.746210190683226e-07,7.715229757141223e-07,2.879577276436887e-05,-5.601157850193648e-07,1.503136544313396e-06,-9.462792084917527e-07,-1.9541047707513875e-06,-6.43816706004403e-07,1.5893229477408117e-07,-3.025604545545755e-07,7.647242447199914e-07,9.914512923580468e-07,3.6495795981343053e-07,1.9570982184637573e-06,-3.768014435807822e-07],[1.263912310685817e-06,7.040529849921694e-08,-3.6432133497661077e-07,-5.601157850193648e-07,3.045196787463797e-05,1.2642115805407242e-07,-2.4058797613448973e-06,-1.2080387320643804e-06,-8.470860220073912e-07,-3.117191939503304e-07,1.6711421163870622e-06,-1.9877318302141588e-07,1.2140297035299447e-06,1.6792485259335223e-06,-1.2342797256433065e-06,-7.609101247584123e-08],[-5.149186008451908e-07,2.565344108659552e-07,-1.2933710492821707e-06,1.503136544313396e-06,1.2642115805407242e-07,2.730554437378564e-05,-3.9421925105209494e-07,-4.143512338427957e-06,3.445047292797524e-07,9.201588816672808e-07,-3.3154700107141075e-07,2.0356693961425677e-06,6.3020929435261e-07,-4.90718140401523e-07,-1.8989305174100154e-07,-3.062598352711921e-06],[-7.634472718467057e-07,-1.8553309153421774e-06,1.7542817153138252e-06,-9.462792084917527e-07,-2.4058797613448973e-06,-3.9421925105209494e-07,2.5311785801980433e-05,9.888350504307544e-07,1.8686029668013668e-07,3.85055667913842e-07,1.1077822845900295e-06,3.54316603118944e-07,3.8596368417849797e-07,-1.3735449772289298e-06,-2.0191682880603513e-06,7.980605124438567e-07],[-1.3206605127402331e-06,6.788050231651385e-07,-1.3452206944871466e-06,-1.9541047707513875e-06,-1.2080387320643804e-06,-4.143512338427957e-06,9.888350504307544e-07,2.775633704022418e-05,8.6170449736391e-07,3.530635501692884e-07,1.053239418906833e-06,-4.834409548418061e-07,-1.576049729072886e-06,-1.0559030519074887e-06,-4.312463431894934e-07,6.717886862625214e-07],[7.875936125825766e-07,-1.0445766391037384e-06,8.613706378269227e-07,-6.43816706004403e-07,-8.470860220073912e-07,3.445047292797524e-07,1.8686029668013668e-07,8.6170449736391e-07,2.746413513469367e-05,-3.079664868989432e-07,-4.842141526072684e-07,-1.708722335208717e-06,-1.085280534986643e-06,-1.947938104619585e-06,-1.918997043861818e-06,4.985990452316439e-08],[-2.3360090480436999e-07,-1.6632642964977067e-07,-4.644481614624931e-07,1.5893229477408117e-07,-3.117191939503304e-07,9.201588816672808e-07,3.85055667913842e-07,3.530635501692884e-07,-3.079664868989432e-07,2.8508243225677485e-05,-8.964815149775067e-07,-1.9061680536639263e-06,-1.105758406401443e-06,-7.802728374512778e-07,-5.372891089769115e-07,-3.45123051075952e-06],[-1.0027201554863186e-06,4.367098667001207e-07,-8.653914942585443e-07,-3.025604545545755e-07,1.6711421163870622e-06,-3.3154700107141075e-07,1.1077822845900295e-06,1.053239418906833e-06,-4.842141526072684e-07,-8.964815149775067e-07,2.72203338467352e-05,-4.121545324290927e-07,-1.243794692378385e-06,3.3912076531660496e-08,-2.2598479818793263e-06,-9.965262558773628e-07],[6.872592667652936e-07,-1.6520668729734064e-06,8.05495508366179e-07,7.647242447199914e-07,-1.9877318302141588e-07,2.0356693961425677e-06,3.54316603118944e-07,-4.834409548418061e-07,-1.708722335208717e-06,-1.9061680536639263e-06,-4.121545324290927e-07,2.7935103287612332e-05,9.924023358414818e-07,-2.662332575586591e-06,-4.48167921690052e-07,1.5977588514241963e-06],[-6.026033364877671e-07,9.37858369622249e-07,-8.525714555277447e-08,9.914512923580468e-07,1.2140297035299447e-06,6.3020929435261e-07,3.8596368417849797e-07,-1.576049729072886e-06,-1.085280534986643e-06,-1.105758406401443e-06,-1.243794692378385e-06,9.924023358414818e-07,2.6341835987421982e-05,5.410467005247509e-07,1.207148315170928e-06,-1.8008807539535691e-07],[4.2760470574288703e-07,1.1285780675636668e-06,1.188905008095886e-06,3.6495795981343053e-07,1.6792485259335223e-06,-4.90718140401523e-07,-1.3735449772289298e-06,-1.0559030519074887e-06,-1.947938104619585e-06,-7.802728374512778e-07,3.3912076531660496e-08,-2.662332575586591e-06,5.410467005247509e-07,3.0623571188072746e-05,8.748623605434708e-07,3.140162923364441e-06],[1.7765783294070405e-06,4.588544133046915e-07,1.3838305299639564e-06,1.9570982184637573e-06,-1.2342797256433065e-06,-1.8989305174100154e-07,-2.0191682880603513e-06,-4.312463431894934e-07,-1.918997043861818e-06,-5.372891089769115e-07,-2.2598479818793263e-06,-4.48167921690052e-07,1.207148315170928e-06,8.748623605434708e-07,3.2571725171395836e-05,-5.130956022801078e-07],[-1.7564232387905573e-08,2.1246135912043567e-06,1.1393601100398791e-06,-3.768014435807822e-07,-7.609101247584123e-08,-3.062598352711921e-06,7.980605124438567e-07,6.717886862625214e-07,4.985990452316439e-08,-3.45123051075952e-06,-9.965262558773628e-07,1.5977588514241963e-06,-1.8008807539535691e-07,3.140162923364441e-06,-5.130956022801078e-07,3.0234228110511548e-05]],"coefficient_covariance_dimension":16,"coefficient_covariance_order":["sin_1","sin_2","sin_3","sin_4","sin_5","sin_6","sin_7","sin_8","cos_1","cos_2","cos_3","cos_4","cos_5","cos_6","cos_7","cos_8"],"cosine_coefficients":[0.10257850923717897,-0.08504203749241829,0.02396516301245546,0.011175166819801647,-0.010659348955773517,0.005539902519645755,0.0006982856833193475,0.0008050525429238732],"fundamental_frequency":1.5754179347468193,"harmonic_count":8,"intercept":1.0202950695545894,"metadata":{"catalog_period_days":0.6347522,"coefficient_covariance_order":"sine_1..sine_N,cosine_1..cosine_N","coefficient_snr":[22.289248981531745,11.493158025132322,6.2962113343415504,4.497271530990679,1.9174919460133684,1.2507856558848889,0.1408754298800289,0.5360709436418737],"covariance_inflation":1.891977484099288,"design_condition_number":1.6913490745660866,"effective_rank":17,"evidence_role":"exposed-development-only","extraction_model":"weighted_signed_harmonic_regression","family":"rr_lyrae","intercept":1.0202950695545894,"intercept_variance":1.409631971116041e-05,"mode":"RRab","normal_condition_number":2.8602735959784034,"original_object_id_withheld":true,"original_source_locator_withheld":true,"period_evidence_grade":"EXTERNAL_CATALOG_CROSSCHECK","period_source":"OGLE LMC RR Lyrae catalog cross-check; 0.6347522 d","phase19_blinded_control":true,"phase_coverage":{"bins":12,"chi_square_uniform":3.4216867469879517,"counts":[29,21,30,27,31,26,24,29,31,27,29,28],"maximum_circular_gap":0.018042946522513148,"occupancy_fraction":1.0,"occupied_bins":12},"physical_claim_scope":"waveform-only","reduced_chi_square":1.891977484099288,"residual_rmse":0.06963173794193699,"ridge":0.0001,"sample_count":332,"weighted_chi_square":595.9729074912757},"object_id":"P19-94C05A","reference_epoch":2184.81907,"schema_version":"DERD-HARMONIC-EXCHANGE-1.0","sine_coefficients":[-0.13216285871208383,-0.01603442499623993,0.04085628738999248,-0.03197691687769573,0.009756861106504009,-0.007741933852187149,-0.0008131092839140151,-0.004002094248626089],"source_locator":"phase19:blinded-derived-control:P19-94C05A","source_sha256":"798e885aa64d3fa2827b165239cccf5463794735ec82a891d52c242cb4d2eb6a","time_unit":"day","value_unit":"relative_flux"}
