{"canonical_series":"y=c0+sum(c_n*exp(i*2*pi*n*f*(t-t0))+conjugate)","cosine_coefficients":[-0.6091060118543065,-0.16002138105782787,0.00041656037509167924,0.0019509751116548707,0.0058852351949685005,0.004533596060618617,0.0023571103303178863,0.00103553783967944],"fundamental_frequency":1.0,"harmonic_count":8,"metadata":{"not_observational_evidence":true,"purpose":"lossless exchange-schema positive control"},"object_id":"SYNTHETIC-DERD-HEX-001","reference_epoch":0.173,"schema_version":"DERD-HARMONIC-EXCHANGE-1.0","sine_coefficients":[0.47066965325546195,-0.20094311592154457,-0.06219216423518642,-0.024504990365775397,-0.011006116628889702,-0.0031643747969660285,-0.0004500072390189354,0.0002369462342511827],"source_locator":"synthetic:phase06-fixed-example","source_sha256":"86c7d8053b1df9e10b4b7fbe1a48933bdce0cb44691ce4c401fa584c5b4e8b9d","time_unit":"cycle","value_unit":"arbitrary_normalized_flux"}
