{"canonical_series":"y=c0+sum(c_n*exp(i*2*pi*n*f*(t-t0))+conjugate)","coefficient_covariance":[[4.618077624505434e-06,5.150353511314029e-07,4.1104019301479776e-08,8.389370361606722e-07,-1.996496813197016e-07,-9.934893354249097e-07,8.060028023335831e-07,2.37828391520322e-06,-7.001136897329078e-07,-1.2918640756048583e-06,2.511107562378448e-06,1.8359616850257986e-06,-1.6403289759515786e-06,-1.4255854629438238e-06,2.9586413271392255e-08,-1.3064163808441353e-06],[5.150353511314029e-07,5.157455619680234e-06,1.8452745970573136e-06,1.2226080526085252e-07,-7.287642740691029e-07,1.0610912841379792e-06,2.3210007201350704e-06,1.8310621774186258e-06,1.1821989609630433e-07,1.5768500037862171e-06,1.152220923124254e-06,1.6731001565820546e-06,4.669337687069785e-07,-2.168317805056045e-06,-3.3381997529998034e-06,-1.1762306818912155e-06],[4.1104019301479776e-08,1.8452745970573136e-06,5.2901148606846505e-06,6.857476141724882e-08,2.437099160627979e-07,2.020618462224261e-06,2.2163900080712535e-06,1.3460223869559008e-06,5.341420057938661e-07,1.4138643528514326e-06,7.877096586520369e-07,1.3996625424698053e-07,1.4279394068529678e-06,-1.9117638903567323e-06,-2.7479696418507655e-06,-3.58554330727918e-07],[8.389370361606722e-07,1.2226080526085252e-07,6.857476141724882e-08,5.113553845127439e-06,2.861662129291445e-06,9.786414899006348e-07,1.091397837877737e-06,9.86512821695157e-07,-2.6614231364982287e-07,-9.145738945372337e-07,4.418189520694904e-07,3.4753830574213606e-07,-1.6775444973595663e-06,3.946005114984651e-07,1.43834619783846e-06,-7.361091486273157e-07],[-1.996496813197016e-07,-7.287642740691029e-07,2.437099160627979e-07,2.861662129291445e-06,6.709553954529499e-06,2.6152717790958426e-06,5.085410230381759e-07,-1.390470841624985e-06,1.1864607297194723e-06,-8.263604733266663e-07,-1.27058237084279e-06,-1.8173081316269724e-06,-3.0159534789016726e-07,1.8664884719931004e-06,1.6379645131026542e-06,-2.243048322169213e-07],[-9.934893354249097e-07,1.0610912841379792e-06,2.020618462224261e-06,9.786414899006348e-07,2.6152717790958426e-06,6.350312026962107e-06,1.300940163057279e-07,-4.232390177460392e-07,1.06955625716663e-06,2.3641109495321304e-06,-1.933182468707644e-06,-1.4141532106253935e-06,1.48531642723524e-06,8.671828052608618e-07,-1.4268002807272487e-06,-1.3721944382097416e-06],[8.060028023335831e-07,2.3210007201350704e-06,2.2163900080712535e-06,1.091397837877737e-06,5.085410230381759e-07,1.300940163057279e-07,5.918498484367947e-06,9.521606554254232e-07,6.91188224423736e-07,-5.4416147286169085e-09,2.0083435507462027e-06,1.2565104865583818e-06,7.715598355037739e-08,-1.799414564589087e-06,-2.544767720318758e-06,-1.3110852533006004e-06],[2.37828391520322e-06,1.8310621774186258e-06,1.3460223869559008e-06,9.86512821695157e-07,-1.390470841624985e-06,-4.232390177460392e-07,9.521606554254232e-07,5.9615571136850646e-06,-1.6400636875694402e-06,-4.270865305480438e-07,2.809352835279795e-06,2.746485625865774e-06,-1.2116330900156425e-06,-3.2667361420584864e-06,-1.0878130173289212e-06,-7.994232579924372e-08],[-7.001136897329078e-07,1.1821989609630433e-07,5.341420057938661e-07,-2.6614231364982287e-07,1.1864607297194723e-06,1.06955625716663e-06,6.91188224423736e-07,-1.6400636875694402e-06,3.927890617802337e-06,8.723583922837215e-07,-5.548543409315852e-07,-3.854997553519654e-07,3.1656009261523787e-07,7.818776559441805e-07,-7.560649356152135e-07,-1.3719302062336153e-06],[-1.2918640756048583e-06,1.5768500037862171e-06,1.4138643528514326e-06,-9.145738945372337e-07,-8.263604733266663e-07,2.3641109495321304e-06,-5.4416147286169085e-09,-4.270865305480438e-07,8.723583922837215e-07,4.768289495192119e-06,2.4326712973563133e-07,2.899614197285398e-09,8.340002231998885e-07,-3.036319162231847e-07,-2.753050981605554e-06,-1.9458649978594096e-06],[2.511107562378448e-06,1.152220923124254e-06,7.877096586520369e-07,4.418189520694904e-07,-1.27058237084279e-06,-1.933182468707644e-06,2.0083435507462027e-06,2.809352835279795e-06,-5.548543409315852e-07,2.4326712973563133e-07,5.877106674584973e-06,2.5804999481545e-06,-1.0357736600716798e-06,-3.1607629217851216e-06,-2.3347994882217485e-06,-1.81916632537502e-06],[1.8359616850257986e-06,1.6731001565820546e-06,1.3996625424698053e-07,3.4753830574213606e-07,-1.8173081316269724e-06,-1.4141532106253935e-06,1.2565104865583818e-06,2.746485625865774e-06,-3.854997553519654e-07,2.899614197285398e-09,2.5804999481545e-06,5.2976859948524556e-06,-1.1587512289165578e-06,-2.8191422079895616e-06,-2.07407120981009e-06,-8.168767310706474e-07],[-1.6403289759515786e-06,4.669337687069785e-07,1.4279394068529678e-06,-1.6775444973595663e-06,-3.0159534789016726e-07,1.48531642723524e-06,7.715598355037739e-08,-1.2116330900156425e-06,3.1656009261523787e-07,8.340002231998885e-07,-1.0357736600716798e-06,-1.1587512289165578e-06,3.842642999794085e-06,-1.4291310506092778e-07,-9.38224207766643e-07,1.0525803140700198e-06],[-1.4255854629438238e-06,-2.168317805056045e-06,-1.9117638903567323e-06,3.946005114984651e-07,1.8664884719931004e-06,8.671828052608618e-07,-1.799414564589087e-06,-3.2667361420584864e-06,7.818776559441805e-07,-3.036319162231847e-07,-3.1607629217851216e-06,-2.8191422079895616e-06,-1.4291310506092778e-07,6.1727569708150684e-06,3.2156906095086603e-06,-5.568729933195214e-08],[2.9586413271392255e-08,-3.3381997529998034e-06,-2.7479696418507655e-06,1.43834619783846e-06,1.6379645131026542e-06,-1.4268002807272487e-06,-2.544767720318758e-06,-1.0878130173289212e-06,-7.560649356152135e-07,-2.753050981605554e-06,-2.3347994882217485e-06,-2.07407120981009e-06,-9.38224207766643e-07,3.2156906095086603e-06,6.911136249836081e-06,2.906359728052006e-06],[-1.3064163808441353e-06,-1.1762306818912155e-06,-3.58554330727918e-07,-7.361091486273157e-07,-2.243048322169213e-07,-1.3721944382097416e-06,-1.3110852533006004e-06,-7.994232579924372e-08,-1.3719302062336153e-06,-1.9458649978594096e-06,-1.81916632537502e-06,-8.168767310706474e-07,1.0525803140700198e-06,-5.568729933195214e-08,2.906359728052006e-06,6.357284402257738e-06]],"coefficient_covariance_dimension":16,"coefficient_covariance_order":["sin_1","sin_2","sin_3","sin_4","sin_5","sin_6","sin_7","sin_8","cos_1","cos_2","cos_3","cos_4","cos_5","cos_6","cos_7","cos_8"],"cosine_coefficients":[0.12021559052425894,-0.05424553578476448,-0.004484784297591018,0.002534160126138132,0.0001694552444397449,0.001706058681648016,0.0005223883141574694,0.0019662176845127604],"fundamental_frequency":0.32070308378464274,"harmonic_count":8,"intercept":1.0218087230833894,"metadata":{"band":"V","claim_boundary":"signed harmonic and passband-shape evidence only","coefficient_covariance_order":["sin_1","sin_2","sin_3","sin_4","sin_5","sin_6","sin_7","sin_8","cos_1","cos_2","cos_3","cos_4","cos_5","cos_6","cos_7","cos_8"],"covariance_estimator":"hc3","design_condition_number":4.578430923215874,"fit_domain":"flux","input_domain":"magnitude","intercept":1.0218087230833894,"observation_count":65,"period_days":3.1181490000000003,"phase":20,"phase_coverage":{"bin_count":12,"bin_counts":[9,8,8,4,5,4,5,5,6,5,3,3],"maximum_bin_count":9,"maximum_circular_phase_gap":0.07507081925837156,"median_circular_phase_gap":0.008886361748523086,"minimum_bin_count":3,"occupied_bins":12},"reference_epoch_policy":"explicit","residual_rmse":0.009021135365861695,"ridge":0.0001,"scope":"merged_v","weighted_reduced_chi_square":4.147591178101416},"object_id":"OGLE-LMC-CEP-0002","reference_epoch":2171.85654,"schema_version":"DERD-HARMONIC-EXCHANGE-1.0","sine_coefficients":[-0.13738974397583087,-0.0299898554550145,0.021660039787665467,-0.0013120531148495982,-0.0006655099522396575,-0.0035886916654818677,-0.0031951414732579574,3.603733067922539e-05],"source_locator":"deterministic chronological merge of the two official source URLs","source_sha256":"420871872497c8fccd8afe273a6548d079f59028f1067dcc1cd9c5f56711729d","time_unit":"day","value_unit":"relative_flux"}
